original_column_name,column_name,column_description,data_format,value_description
id_restaurant,id restaurant,the unique id for the restaurant,integer,
label,,the label of the restaurant,text,
food_type,food type,the food type,text,
city,,the city where the restaurant is located in,text,
review,,the review of the restaurant,real,"commonsense evidence:
the review rating is from 0.0 to 5.0
The high review rating is positively correlated with the overall level of the restaurant. The restaurant with higher review rating is usually more popular among diners. "
